{
  "schema_version": "1.0",
  "event_id": "evt_01J9XA",
  "event_type": "outcome.updated",
  "correlation_id": "corr_4c21f9",
  "intent_id": "int_01J9X3",
  "verdict_id": "ver_9P0",
  "verdict": "UNKNOWN",
  "summary": "We could not confirm the result yet. A person will review it.",
  "occurred_at": "2026-10-01T09:48:36Z",
  "sig": {
    "key_id": "tenant-webhook-1",
    "value": "c2ln"
  }
}
